{
  "$schema": "../../spec/v1/schemas/release-manifest.schema.json",
  "apiVersion": "ops.company/v1",
  "manifestKind": "ReleaseManifest",
  "metadata": {
    "projectId": "sample-system",
    "version": "1.0.0",
    "releaseId": "sample-system-1.0.0-20260811.1",
    "builtAt": "2026-08-11T08:00:00Z",
    "sourceRevision": "0123456789abcdef0123456789abcdef01234567"
  },
  "target": {
    "os": "windows",
    "architecture": "x64",
    "minAgentVersion": "0.1.0"
  },
  "projectManifestSha256": "aaaaaaaaaaaaaaaaaaaaaaaaaaaaaaaaaaaaaaaaaaaaaaaaaaaaaaaaaaaaaaaa",
  "artifacts": [
    {
      "id": "backend-package",
      "fileName": "sample-system-backend-1.0.0.zip",
      "mediaType": "application/zip",
      "sha256": "bbbbbbbbbbbbbbbbbbbbbbbbbbbbbbbbbbbbbbbbbbbbbbbbbbbbbbbbbbbbbbbb",
      "sizeBytes": 1048576
    },
    {
      "id": "frontend-package",
      "fileName": "sample-system-frontend-1.0.0.zip",
      "mediaType": "application/zip",
      "sha256": "cccccccccccccccccccccccccccccccccccccccccccccccccccccccccccccccc",
      "sizeBytes": 524288
    }
  ],
  "componentPayloads": [
    {
      "componentId": "api",
      "entrypoint": "api-main",
      "artifactId": "backend-package",
      "path": "api/Sample.Api.exe",
      "workingDirectory": "api",
      "arguments": [
        "--urls",
        "http://127.0.0.1:${PORT_API_HTTP}"
      ]
    },
    {
      "componentId": "web",
      "entrypoint": "web-dist",
      "artifactId": "frontend-package",
      "path": "dist"
    },
    {
      "componentId": "cleanup",
      "entrypoint": "cleanup-main",
      "artifactId": "backend-package",
      "path": "jobs/Sample.Cleanup.exe",
      "workingDirectory": "jobs"
    },
    {
      "componentId": "legacy-worker",
      "entrypoint": "legacy-worker-main",
      "artifactId": "backend-package",
      "path": "legacy/worker.py",
      "workingDirectory": "legacy",
      "arguments": [],
      "pm2": {
        "name": "sample-system-legacy-worker",
        "cwd": "legacy",
        "script": "legacy/worker.py",
        "arguments": []
      }
    }
  ]
}
